{
  "dialect": "nougendesigns/v0",
  "name": "nougen-capture",
  "version": "0.1.0",
  "description": "Matte graphite capture instrument for browser extension popup, options page, context menu actions, and store listing.",
  "referenceWorld": "Browser extension toolbar popup (~360px wide), options workspace, browser context menu, and Chrome Web Store listing surfaces.",
  "antiPatterns": "Reject decorative gradients, glass, glow, giant pills, sparkles, waveform noise and generic SaaS card grids.",
  "materiality": "Use opaque graphite surfaces, fine dividers and matte amber accents.",
  "density": "Optimized for a 360px popup container and expansive options page. Compact functional groupings with 14px readable body copy, single-column vertical flow in popup, and monospace data rows for capture telemetry. Negative space defines boundaries between target selection and capture controls.",
  "motionGrammar": "Use short deliberate state transitions. Disable nonessential motion when reduced motion is requested.",
  "interactionPhysics": "Inputs respond immediately; asynchronous work exposes progress, cancellation and recovery. Refer to shared objects by stable, scoped identity instead of row position or left/right language. Selection, inspection and handoff refer to the same record; local view changes do not silently imply a synchronized peer view.",
  "informationHierarchy": "Prioritize active capture target and failure states above secondary vault metadata. Store title follows 'Brand: Function' under 30 characters ('NouGen: Shard Capture'); store summary stays near 100 characters ('Capture web selections, URLs, and context directly into your verified NouGen shard vault without friction.'). Extension UI retains dark graphite palette; light canvas is reserved strictly for store listing hero art. Omit AI badges, sparkles, or promotional AI tags across all user-facing copy.",
  "responsiveBehavior": "Popup operates fixed at ~360px width with intrinsic vertical flow and no horizontal scrolling. Options page stacks sections below 600px width. Context menu binds directly to target selection. Text wraps cleanly without clipping long vault identifiers or target URLs.",
  "accessibility": "Body text must meet 4.5:1 and focus/status indicators 3:1. Preserve labels and keyboard access. Measured default text on ground: 15.92:1; muted on panel: 8.24:1; focus on ground: 10.10:1. These are declared token pairs, not a complete application audit. Inputs have explicit accessible names. Controls have a 24px minimum target and 44px touch target. Reflow at 320px and text-size growth are verification requirements.",
  "brandVoice": "Technical, precise, and verb-first ('Capture selection', 'Save target', 'Configure vault'). Omit promotional buzzwords, vague superlatives, and AI badges. Errors state the exact operational fault and specific recovery steps without metaphor.",
  "iconography": "Use consistent monochrome line icons; pair unfamiliar symbols with labels.",
  "dataViz": "Use labelled axes and text status; color alone never conveys meaning. Preserve data-bearing bar lengths, baselines, scales and area encodings when applying visual metaphors. Decorative integration belongs outside measured geometry. Missing evidence is unavailable, not zero.",
  "stateGrammar": "Popup lifecycle encompasses four distinct states: 'capture ok', 'not captured', 'not configured', and 'offline'. The interface strictly reads the server-returned 'captured' boolean flag to determine success versus failure, never relying on transport HTTP status codes alone. Options credentials mask tokens permanently after saving; only whether a token is saved is shown, never its value.",
  "provenance": "Adapted from NouGen core design tokens and extension design research. Extension constraints, store metadata patterns, and listing assets are derived from empirical Chrome Web Store top-200 analysis. Palette and layout rules maintain NouGen fleet continuity with inferred store asset transformations.",
  "tokens": {
    "--bg": "#141414",
    "--bg-gradient": "var(--bg)",
    "--panel": "#202020",
    "--panel-solid": "#202020",
    "--panel-2": "#282828",
    "--panel-hover": "#333333",
    "--line": "#777777",
    "--line-glow": "#777777",
    "--text": "#f2eee6",
    "--muted": "#bdb8ad",
    "--accent": "#e8b86d",
    "--accent-rgb": "232, 184, 109",
    "--accent-2": "#e8b86d",
    "--accent-purple": "#c8bfad",
    "--accent-green": "#a9c79b",
    "--danger": "#ffb4ab",
    "--warn": "#e8b86d",
    "--focus": "#e8b86d",
    "--radius-sm": "2px",
    "--radius-md": "3px",
    "--radius-lg": "4px",
    "--font-main": "system-ui, sans-serif",
    "--font-mono": "Consolas, monospace",
    "--space-1": "0.25rem",
    "--space-2": "0.5rem",
    "--space-3": "0.75rem",
    "--space-4": "1rem",
    "--space-5": "1.5rem",
    "--space-6": "2rem",
    "--motion-fast": "120ms",
    "--motion-ease": "ease-out",
    "--control-ink": "#141414",
    "--reading-measure": "65ch",
    "--workbench-width": "87.5rem",
    "--type-body": "1rem",
    "--type-meta": "0.8125rem",
    "--line-body": "1.65",
    "--target-min": "1.5rem",
    "--target-touch": "2.75rem",
    "--cluster-gap": "1.25rem",
    "--fleet-card-min": "23rem"
  },
  "themes": {
    "dark": {},
    "light": {
      "--bg": "#f5f1e8",
      "--panel": "#ffffff",
      "--panel-solid": "#ffffff",
      "--panel-2": "#eee9df",
      "--panel-hover": "#e1dbce",
      "--text": "#202020",
      "--muted": "#555047",
      "--accent": "#765013",
      "--accent-2": "#765013",
      "--focus": "#765013",
      "--control-ink": "#ffffff",
      "--danger": "#a62520",
      "--line": "#76716a"
    }
  },
  "evidence": [
    {
      "kind": "observed",
      "source": "ui/src/styles.css",
      "note": "Existing semantic token names and workbench selectors."
    },
    {
      "kind": "invented",
      "source": "NouGenDesigns v0 relay brief",
      "note": "Graphite and amber palette; local Ollama draft, Codex review."
    },
    {
      "kind": "observed",
      "source": "references/chrome-webstore-top200.json",
      "note": "200 Web Store extensions rated >=4.5 from 20 category listings; not a global ranking"
    },
    {
      "kind": "observed",
      "source": "references/chrome-webstore-analysis.md",
      "note": "icon hue neutral 51/blue 43 of 200; first screenshot light 85, mid 68, dark 47; 86/200 names use a tagline separator; median name 28 chars, description 99 chars; 22/200 mention AI; screenshot count median 10 per listing (range 1-12, saturates at 12, includes carousel promo tiles)"
    },
    {
      "kind": "inferred",
      "source": "popup state specification",
      "note": "Popup states (capture ok/not captured/not configured/offline) must read the server's captured flag, never HTTP status."
    },
    {
      "kind": "inferred",
      "source": "options security rule",
      "note": "Authentication token must never be shown after save; display masked verification status instead."
    },
    {
      "kind": "inferred",
      "source": "store metadata constraints",
      "note": "Store title formatted as 'Brand: Function' under ~30 chars and store summary near ~100 chars derived from top-200 medians."
    },
    {
      "kind": "inferred",
      "source": "store visual presentation",
      "note": "In-extension UI retains dark graphite surfaces, while light canvas is permitted only for store hero art based on screenshot brightness analysis."
    },
    {
      "kind": "inferred",
      "source": "copywriting policy",
      "note": "Reject AI badges and tags in copy, aligning with the observed 22/200 low-incidence pattern and instrument voice."
    }
  ],
  "contrastPairs": [
    {
      "ink": "--text",
      "ground": "--bg"
    },
    {
      "ink": "--muted",
      "ground": "--panel"
    },
    {
      "ink": "--control-ink",
      "ground": "--accent"
    },
    {
      "ink": "--focus",
      "ground": "--bg",
      "role": "ui"
    }
  ],
  "componentMutations": [
    {
      "selector": ".fixed-header-zone",
      "change": "Opaque panel, fine divider, remove blur."
    },
    {
      "selector": ".neural-bg-canvas",
      "change": "Hide decorative neural background."
    },
    {
      "selector": ":focus-visible",
      "change": "Visible amber keyboard outline."
    },
    {
      "selector": ".shard-body",
      "change": "Use reading-measure token and explicit native full-memory disclosure."
    },
    {
      "selector": ".input-glow-wrap input",
      "change": "Provide accessible search name."
    },
    {
      "selector": ".shard-actions button",
      "change": "Provide explicit keyboard-accessible Inspect action instead of a clickable article."
    },
    {
      "selector": ".fleet-node-grid",
      "change": "Use container-fitting columns with fleet-card-min and cluster-gap tokens; never force three columns into a narrow pane."
    },
    {
      "selector": ".hw-row, .role-item",
      "change": "Preserve label/value grouping; stack inside cards below 18rem and wrap long values."
    }
  ]
}