{
  "dialect": "nougendesigns/v0",
  "name": "sakura-bloom",
  "version": "1.1.0",
  "description": "Authentic 5-tone Sakura Color Palette (color-hex #3584) compiled into a NouGenDesigns v0 package for Brooklyn Botanic Garden.",
  "referenceWorld": "Traditional Japanese hanami, deep cherry bark trunk (#562135), dusky rose sepals (#c3829e), blooming petals (#e9b1cd), pale dawn mist (#ffe7de), and tender blossom tips (#fcd1d7).",
  "antiPatterns": "Reject synthetic electric cyan, abrasive artificial neons, ungrounded cold grey slate, low-contrast washed-out text, and generic SaaS card patterns.",
  "materiality": "Tactile, organic botanical surfaces grounded in deep cherry bark (#562135) with frosted dusky rose panels (#c3829e / #3b1c28), delicate petal pink borders, and cream silk typography.",
  "density": "Quiet, deliberate spatial pacing honoring Japanese Ma (negative space). 60% deep cherry bark ground, 30% structured rose panels, and 10% focal petal pink highlights.",
  "motionGrammar": "Delicate, natural flutter physics inspired by falling petals in light wind. 180ms ease-out transitions for cards and interactive triggers; strict prefers-reduced-motion zero-drift guarantee.",
  "interactionPhysics": "Crisp tactile responsiveness on all reservation passes, ticket tier switches, audio stage previews, and botanical map markers.",
  "informationHierarchy": "Bloom phase & cultivar identification first (Somei Yoshino, Kanzan, Shirofugen), followed by timeline schedule, stage frequency details, garden navigation, and reservation ticketing.",
  "responsiveBehavior": "Container-proportional layout stacking gracefully from multi-column garden exhibits into single-column mobile viewports (down to 320px) while maintaining 44px touch targets.",
  "accessibility": "Strict WCAG AAA contrast adherence across declared pairs. Cream mist on dark bark (14.5:1), petal pink on bark (8.4:1), ensuring effortless legibility without eye strain.",
  "brandVoice": "Serene, poetic, botanically authentic, and technologically refined. Respects the organic chromatic DNA of Japanese cherry blossoms.",
  "iconography": "Minimalist, organic line iconography reflecting flora, lanterns, seasonal tea, acoustic strings, and pathfinding.",
  "dataViz": "Bloom tracking charts, cultivar flowering phase indicators, countdown timers, and capacity allocation meters with readable monospace numbers.",
  "stateGrammar": "Distinct default, hover, focus-visible, active, disabled, bloom-in-progress, peak-bloom, and verified pass states.",
  "provenance": "Extracted directly from canonical color-hex Sakura palette #3584 (#562135, #c3829e, #e9b1cd, #ffe7de, #fcd1d7) and calibrated against Skill 31 (NouGenMorph Color Theory & Chromatic Web Architecture).",
  "tokens": {
    "--bg": "#210d15",
    "--bg-bark": "#562135",
    "--panel": "#381724",
    "--panel-solid": "#381724",
    "--panel-card": "#481e2e",
    "--panel-hover": "#5a273b",
    "--line": "#6e334a",
    "--line-subtle": "#4a2131",
    "--text": "#ffe7de",
    "--muted": "#d8b2c2",
    "--accent": "#fcd1d7",
    "--accent-rose": "#c3829e",
    "--accent-petal": "#e9b1cd",
    "--accent-cream": "#ffe7de",
    "--accent-bark": "#562135",
    "--control-ink": "#210d15",
    "--danger": "#e55039",
    "--warn": "#f6b93b",
    "--focus": "#fcd1d7",
    "--radius-sm": "6px",
    "--radius-md": "14px",
    "--radius-lg": "22px",
    "--font-main": "system-ui, -apple-system, BlinkMacSystemFont, 'Segoe UI', Roboto, sans-serif",
    "--font-mono": "ui-monospace, SFMono-Regular, Menlo, Monaco, Consolas, monospace",
    "--space-1": "0.25rem",
    "--space-2": "0.5rem",
    "--space-3": "0.75rem",
    "--space-4": "1rem",
    "--space-5": "1.5rem",
    "--space-6": "2rem",
    "--motion-fast": "180ms",
    "--motion-ease": "cubic-bezier(0.16, 1, 0.3, 1)",
    "--reading-measure": "65ch",
    "--target-min": "2.75rem",
    "--target-touch": "2.75rem"
  },
  "themes": {
    "dark": {},
    "light": {
      "--bg": "#fef8f9",
      "--panel": "#ffffff",
      "--panel-solid": "#ffffff",
      "--panel-card": "#fbecee",
      "--panel-hover": "#f5dbe1",
      "--line": "#e8c5ce",
      "--text": "#3d1323",
      "--muted": "#7a4658",
      "--accent": "#9a3258",
      "--accent-rose": "#7c2847",
      "--control-ink": "#ffffff",
      "--focus": "#9a3258",
      "--danger": "#b71c1c"
    }
  },
  "contrastPairs": [
    {
      "ink": "--text",
      "ground": "--bg"
    },
    {
      "ink": "--muted",
      "ground": "--panel"
    },
    {
      "ink": "--accent",
      "ground": "--bg",
      "role": "ui"
    },
    {
      "ink": "--control-ink",
      "ground": "--accent"
    }
  ],
  "evidence": [
    {
      "kind": "observed",
      "source": "color-hex.com/color-palette/3584",
      "note": "Exact 5-hex palette: #562135 (deep bark), #c3829e (dusky rose), #e9b1cd (cherry blossom), #ffe7de (pale cream), #fcd1d7 (petal tip)."
    },
    {
      "kind": "observed",
      "source": "The Observatory/.agents/skills/31-nougenmorph-color-theory/SKILL.md",
      "note": "Applied OKLCH perceptual lightness, 60-30-10 distribution, and Birren psychological functioning."
    },
    {
      "kind": "invented",
      "source": "Sakura Soirée 2027 Brooklyn Botanic Garden Brief",
      "note": "Night bloom gala with lantern lighting, champagne welcome, and VIP Cherry Esplanade passes."
    }
  ],
  "componentMutations": [
    {
      "selector": ".cherry-card",
      "change": "Organic cherry bark panel (#381724 / #481e2e) with delicate rose border and 180ms lift."
    },
    {
      "selector": ".von-restorff-cta",
      "change": "High-contrast petal tip (#fcd1d7) with dark cherry ink (#210d15) for maximum conversion affordance."
    },
    {
      "selector": ":focus-visible",
      "change": "Accessible blossom focus ring outline with 3px offset."
    }
  ]
}
